meeting_name,race_no,race_name,race_time,horse_no,horse_name,age,owner,trainer_name,jockey_name,jockey_colours,weight_stone,weight_pounds,form_code
Matchem Race Meeting,1,Golden Stirrup,1:45pm,,,,,,,,,,
Matchem Race Meeting,1,,,1,Houla Cove,6,Mr and Mrs Simon Frost,Barry Walters,Jack Frost,"Blue cap, blue with yellow sleeves",11,0,PF252U2
Matchem Race Meeting,1,,,2,Streamline,7,The Blue Racing Syndicate,Emily Wilson,Will Franklin,"Red cap, Red with blue & white sash cross belt",11,0,22/O3214
Matchem Race Meeting,1,,,3,On My Way,6,Lord and Lady Holt,David Ruth,Simon Clarke,"Red & white Striped cap, red sleeves, white with red spots",11,0,21222OP
Matchem Race Meeting,2,Crystal Bowl,2:30pm,,,,,,,,,,
Matchem Race Meeting,2,,,7,Storm Chaser,8,Mrs J Crystal,Louise Carne,Steve Owen,"Light blue and white chequered cap, light blue and white chequered body",11,5,4S/1P
Matchem Race Meeting,2,,,8,Professor Peach,10,Mrs V Tote,Stephen Moss,Carl Felt,"Pink cap, pink diamond sleeves",11,6,PFP
Matchem Race Meeting,2,,,9,Move Along,9,Mr and Mrs G Foxtrot,Charlie Lane,Gary Hodge,"White cap, white with black cross belts and striped sleeves",11,2,1142364-
